date,entry,compound,positive,negative,neutral,emotion,color
2025-10-07,hello hello i am happy today heheheheh,0.5719,0.481,0.0,0.519,Positive 🙂,Green
2025-10-06,I hate today i want to disappear,-0.8074,0.131,0.768,0.101,Very Negative 😭,Dark Red
2025-10-05,I am the best student in the world! I am the best!!!!!,0.8902,0.827,0.0,0.173,Very Positive 😄,Dark Green
2025-10-01,Hello hello hello love,0.6369,0.583,0.0,0.417,Positive 🙂,Green
2025-10-18,I feel happy today because I met my friend in the morning.,0.7845,0.633,0.0,0.367,Very Positive 😄,Dark Green
